{
  "contractVersion": 1,
  "decisionId": "demo-write-request",
  "intent": "Write a synthetic proof file inside the bounded demo workspace.",
  "action": "workspace.write",
  "resource": { "kind": "file", "path": "result.txt", "content": "AgentHub controls the action; the model proposes it.\n" },
  "risk": "medium",
  "evidenceRefs": ["examples/assurance-loop/README.md"],
  "expectedOutcome": { "kind": "file", "sha256": "37f17d2497f6d9388b9550f6e000de17dd7787b4a8fa66c7c19b5559e8155477" }
}
